titles,summaries,title_sentiment_polarity,title_sentiment,summary_sentiment_polarity,summary_sentiment,company
11 Most Promising Psychedelic Stocks According to Hedge Funds,"In this piece, we will take a look at the 11 most promising psychedelic stocks according to hedge funds. If you want to skip our overview of the psychedelic industry and the latest news, then you can take a look at the 5 Most Promising Psychedelic Stocks. The ability to use chemicals to alter one’s […]",0.35,Positive,0.38,Positive,GHRS
15 Best Falling Stocks To Buy Now,"In this article, we will take a detailed look at the 15 Best Falling Stocks To Buy Now. For a quick overview of such stocks, read our article 5 Best Falling Stocks To Buy Now. The Wall Street is headed to end 2023 on a strongly positive note as the Fed’s indication of coming rate cuts have infused a […]",1.0,Positive,0.4934343434343434,Positive,GHRS
GH Research Reports Third Quarter Financial Results and Provides Business Updates,"DUBLIN, Ireland, Nov. 09, 2023 (GLOBE NEWSWIRE) -- GH Research PLC (Nasdaq: GHRS), a clinical-stage biopharmaceutical company dedicated to transforming the treatment of psychiatric and neurological disorders, today reported financial results for the third quarter ended September 30, 2023, and provided business updates. Third Quarter 2023 Financial Highlights Cash position Cash, cash equivalents, other financial assets and marketable securities were $228.7 million as of September 30, 2023, compar",0.0,Neutral,-0.020833333333333332,Negative,GHRS
GH Research Provides Updates and Guidance on its Clinical Development Program for GH001 in Treatment-Resistant Depression,"DUBLIN, Ireland, Sept. 29, 2023 (GLOBE NEWSWIRE) -- GH Research PLC (Nasdaq: GHRS), a clinical-stage biopharmaceutical company dedicated to transforming the treatment of psychiatric and neurological disorders, today provided updates and guidance on its clinical development program for GH001, its proprietary inhalable mebufotenin (5-MeO-DMT) product candidate, in treatment-resistant depression (TRD). Development Strategy As previously announced, following successful completion of our Phase 1/2 tr",0.0,Neutral,0.19444444444444445,Positive,GHRS
GH Research Reports Second Quarter 2023 Financial Results and Provides Business Updates,"DUBLIN, Ireland, Aug. 23, 2023 (GLOBE NEWSWIRE) -- GH Research PLC (Nasdaq: GHRS), a clinical-stage biopharmaceutical company dedicated to transforming the treatment of psychiatric and neurological disorders, today reported financial results for the second quarter ended June 30, 2023 and provided business updates. Second Quarter 2023 Financial Highlights Cash position Cash, cash equivalents, other financial assets and marketable securities were $238.1 million as of June 30, 2023, compared to cas",0.0,Neutral,-0.020833333333333332,Negative,GHRS
Here's Why We're Not Too Worried About GH Research's (NASDAQ:GHRS) Cash Burn Situation,"We can readily understand why investors are attracted to unprofitable companies. For example, biotech and mining...",0.0,Neutral,0.2,Positive,GHRS
‘It’s Really a Brain Chemistry Issue’: Elon Musk Embraces Ketamine in the Battle Against Depression — Here Are 2 Psychedelic Stocks That Analysts Like,"Thinking outside the box has been a hallmark of Elon Musk’s behavior, and now you might be curious about how he actually reaches those ‘out of the box’ thought patterns. Musk has recently been touting the credentials of ketamine, an anesthetic known for its dissociative qualities. The Tesla CEO has said that he occasionally indulges in microdosing of the drug, believing it to be a better choice than traditional antidepressants for treating depression. Musk has also mentioned experiencing depress",0.2,Positive,0.04166666666666667,Positive,GHRS
The 3 Best Psychedelic Stocks to Buy Now,"Psychedelic stocks have a bright future with 13.5% compound annual growth expected through 2029. That growth will certainly draw in investment funding that seeks to capitalize on growth, as psychedelic drugs quickly become a hot topic in the mental health space. Consumers are increasingly interested in mental health and overall awareness is increasing. Mental health advocates have long touted their benefits and favored their mainstream acceptance. Pharmaceutical firms and other traditional healt",1.0,Positive,0.1315079365079365,Positive,GHRS
GH Research Reports First Quarter 2023 Financial Results and Provides Business Highlights,"DUBLIN, Ireland, May 11, 2023 (GLOBE NEWSWIRE) -- GH Research PLC (Nasdaq: GHRS), a clinical-stage biopharmaceutical company dedicated to transforming the treatment of psychiatric and neurological disorders, today reported financial results for the first quarter ended March 31, 2023 and provided business highlights. First Quarter 2023 Financial Highlights Cash position Cash, cash equivalents, other financial assets and marketable securities were $246.1 million as of March 31, 2023, compared to c",0.125,Positive,0.0625,Positive,GHRS
Down More Than 50%: 2 ‘Strong Buy’ Stocks That Are Too Cheap to Ignore,"When stock prices fall, opportunities open up. That’s true whether we’re talking about a general market decline, or a slip in some individual stocks. However, it is crucial for investors to conduct due diligence and investigate the reasons behind the drop in price to ensure that they are making informed investment decisions. The key to success here is recognizing when a low-priced stock is fundamentally unsound or just facing tough trading conditions. Fortunately, Wall Street’s equity analysts a",0.2944444444444444,Positive,0.01691919191919192,Positive,GHRS
10 Best Psychedelic Stocks to Buy According to Hedge Funds,"In this article, we discuss 10 best psychedelic stocks to buy according to hedge funds. If you want to see more stocks in this selection, check out 5 Best Psychedelic Stocks to Buy According to Hedge Funds. Data Bridge Market Research predicts that the psychedelic drugs market will expand at a compound annual growth rate […]",1.0,Positive,0.8333333333333334,Positive,GHRS
GH Research Reports Full Year 2022 Financial Results and Provides Business Updates,"DUBLIN, Ireland, March 02, 2023 (GLOBE NEWSWIRE) -- GH Research PLC (Nasdaq: GHRS), a clinical-stage biopharmaceutical company dedicated to transforming the treatment of psychiatric and neurological disorders, today reported financial results for the full year ended December 31, 2022 and gave updates on its business. Business Updates We are pleased to report that we have recently initiated our multi-center, randomized, double-blind, placebo-controlled Phase 2b trial of GH001 in treatment-resista",0.175,Positive,0.2125,Positive,GHRS
The 3 Best Hydrogen Stocks to Buy in January 2024,"Hydrogen stocks will continue to be in focus in 2024. Countries around the world and their citizens continue to express concern over issues including global warming and decarbonization among others. Hydrogen is particularly important in this regard. When burned, it produces no carbon dioxide. Further, the production of hydrogen produces relatively less greenhouse gas overall making it an attractive choice moving forward. Hydrogen stocks run the gamut from highly speculative to well-established f",1.0,Positive,0.17047619047619048,Positive,HTOO
Fusion Fuel Green Hosts Third Quarter 2023 Investor Update,"SABUGO, Portugal, Dec. 04, 2023 (GLOBE NEWSWIRE) -- Fusion Fuel Green plc (NASDAQ: HTOO) (""Fusion Fuel""), an emerging leader in the green hydrogen sector, today announced financial results for the third quarter ended September 30, 2023. The quarterly shareholder letter is available at https://ir.fusion-fuel.eu/financials-filings/earnings-releases Third Quarter 2023 Highlights Announced long-term green hydrogen supply contract with a Spanish industrial group​Strategic partnership with Duferco Ene",-0.1,Negative,-0.025,Negative,HTOO
Fusion Fuel Receives Purchase Order for 1.25 MW HEVO-Chain Electrolyzer,"Contract further reinforces market acceptance of plug-and-play HEVO-Chain system, strengthens Fusion Fuel’s footprint in hydrogen mobilitySABUGO, Portugal, Nov. 30, 2023 (GLOBE NEWSWIRE) -- Fusion Fuel (NASDAQ: HTOO) announced today that it has entered into a sales contract for a 1.25 MW HEVO-Chain Series NC electrolyzer. The system will employ Fusion Fuel’s plug-and-play HEVO™ technology, which uses modular building blocks to design green hydrogen solutions tailored to individual customer needs",0.0,Neutral,-0.06666666666666667,Negative,HTOO
"Fusion Fuel Green Announces Strategic Tranched Financing from Belike Nominees Pty Ltd., a Macquarie Group Company","DUBLIN, Ireland, Nov. 27, 2023 (GLOBE NEWSWIRE) -- Fusion Fuel Green PLC (Nasdaq: HTOO) (“Fusion Fuel” or the “Company”), an emerging leader in the green hydrogen sector, today announced that it has entered into an agreement with Macquarie Group’s Commodities and Global Markets business (“Macquarie”) for financing of up to $20 million of senior convertible notes (the “Financing”) pursuant to a securities subscription agreement (“Subscription Agreement”), subject to the satisfactions of certain c",-0.2,Negative,-0.07047619047619047,Negative,HTOO
Fusion Fuel Announces Third Quarter 2023 Webcast Date,"SABUGO, Portugal, Nov. 21, 2023 (GLOBE NEWSWIRE) -- Fusion Fuel Green plc (NASDAQ: HTOO) announced today that it will be hosting a live conference call and webcast on Monday, December 4, 2023, to discuss third quarter financial results and operational highlights for the green hydrogen solutions company. Agenda for the Call: 3Q23 Highlights & Financial ReviewMarket and Commercial Update2023/24 Targets and Revenue GuidanceManagement Q&amp;A Join the Webcast: Date: December 4, 2023Time: 10:00am ETParti",0.0,Neutral,-0.03766233766233767,Negative,HTOO
Fusion Fuel Receives Purchase Order from Portuguese Energy Company for 1.25 MW Electrolyzer Facility,"Agreement marks another important milestone in continued commercialization of HEVO-Chain system, advancing hydrogen mobility in northern PortugalSABUGO, Portugal, Nov. 08, 2023 (GLOBE NEWSWIRE) -- Fusion Fuel (NASDAQ: HTOO) announced today that it has entered into a sales contract with a Portuguese energy company for a 1.25 MW HEVO-Chain Series NC electrolyzer. The system will employ Fusion Fuel’s plug-and-play HEVO™ technology, which uses modular building blocks to deliver green hydrogen soluti",0.0,Neutral,0.1,Positive,HTOO
Fusion Fuel Green Receives Nasdaq Deficiency Notice Regarding Minimum Bid Price Requirement,"Ordinary shares will continue to trade on the Nasdaq Global Market, and the Company’s listing on such exchange is not affected by the receipt of the NoticeDUBLIN, Ireland, Nov. 07, 2023 (GLOBE NEWSWIRE) -- On November 7, 2023, Fusion Fuel Green Plc (NASDAQ: HTOO) (the “Company”), an emerging leader in the green hydrogen space, disclosed that on November 6, 2023 the Company received notice (the “Notice”) from the Nasdaq Stock Market LLC (“Nasdaq”) that the Company is not currently in compliance w",-0.2,Negative,-0.10833333333333334,Negative,HTOO
15 Biggest Renewable Energy Companies in Europe,"In this article, we will take a look at the 15 biggest renewable energy companies in Europe. If you want to skip our detailed analysis, go directly to 5 Biggest Renewable Energy Companies in Europe. According to a report by the European Environment Agency, the region has been significantly advancing in using renewable energy sources. The […]",0.0,Neutral,0.21875,Positive,HTOO
3 Hydrogen Stocks That Will Make Early Investors Rich,"With the global push to find clean and sustainable sources of energy, investors need to keep close tabs on hydrogen stocks to make you rich. Granted, this sector isn’t appealing to everyone because of its volatility and unpredictable nature. At the same time, those seeking gargantuan returns may want to earmark this industry for later analysis. Compellingly, Grand View Research points out that in 2022, the global hydrogen generation market reached a valuation of $155.35 billion. Further, experts",0.2375,Positive,0.13863636363636364,Positive,HTOO
Fusion Fuel (HTOO) Receives Purchase Order for HEVO-Chain Tech,Fusion Fuel (HTOO) signs a contract to sell its first 300 kW Electrolyzer and Balance of Plant System.,0.0,Neutral,0.25,Positive,HTOO
Fusion Fuel Receives Purchase Order for 300 kW Electrolyzer and Balance of Plant System from Leading Global Building Solutions Supplier,"Milestone contract represents first sale of HEVO-Chain technology to replace the use of fossil fuels in the industrial sectorSABUGO, Portugal, Sept. 27, 2023 (GLOBE NEWSWIRE) -- Fusion Fuel (NASDAQ: HTOO), a developer of disruptive green hydrogen solutions, is pleased to announce that it has achieved a significant milestone in the commercialization of its HEVO-Chain system with the signing of a contract with a global leader in innovative and sustainable building solutions, operating in the cemen",0.0,Neutral,0.23750000000000002,Positive,HTOO
Elemental Clean Fuels partners with Piney Point Capital and Fusion Fuel to advance Decarbonization Projects in North America,"NEW YORK, Sept. 14, 2023 (GLOBE NEWSWIRE) -- Elemental Clean Fuels (“ECF”), an energy development company focused on the emerging clean fuel economy in North America, today announced that it has recently closed on its first round of external financing from investors Piney Point Capital, a Racon Capital investment vehicle, and Fusion Fuel Green plc (NASDAQ: HTOO) (""Fusion Fuel""), a green hydrogen solutions company. Capital investment provided by Piney Point will be utilized by ECF to further deve",0.3666666666666667,Positive,0.04196969696969698,Positive,HTOO
"Fusion Fuel Announces Strategic Partnership with Elemental Clean Fuels, Strengthens Foothold in North American Green Hydrogen Market","DUBLIN, Ireland, Sept. 14, 2023 (GLOBE NEWSWIRE) -- Fusion Fuel Green plc (NASDAQ: HTOO) (“Fusion Fuel”), a green hydrogen solutions company, announced today that it has entered into definitive agreements with Elemental Clean Fuels (“Elemental”), a newly formed and funded development company focused on originating and developing clean fuel projects in North America. Elemental is led by Zach Steele and Jason Baran, formerly senior executives at Fusion Fuel, along with Jeff Crone, a former advisor",0.05555555555555556,Positive,0.0670995670995671,Positive,HTOO
Q2 2023 Fusion Fuel Green PLC Earnings Call,Q2 2023 Fusion Fuel Green PLC Earnings Call,-0.2,Negative,-0.2,Negative,HTOO
Fusion Fuel Green Hosts Second Quarter 2023 Investor Update,"SABUGO, Portugal, Aug. 30, 2023 (GLOBE NEWSWIRE) -- Fusion Fuel Green plc (NASDAQ: HTOO) (""Fusion Fuel""), an emerging leader in the green hydrogen sector, today announced financial results for the second quarter ended June 30, 2023. The quarterly shareholder letter is available at: https://ir.fusion-fuel.eu/financials-filings/earnings-releases Second Quarter 2023 Highlights Won €2.46 million green hydrogen equipment supply contract with CSIC in SpainPublished inaugural ESG Report 1 MW project in",-0.1,Negative,-0.028571428571428574,Negative,HTOO
Fusion Fuel Announces Second Quarter 2023 Webcast Date,"SABUGO, Portugal, Aug. 17, 2023 (GLOBE NEWSWIRE) -- Fusion Fuel Green plc (NASDAQ: HTOO) announced today that it will be hosting a live conference call and webcast on Wednesday, August 30, 2023, to discuss second quarter financial results and operational highlights for the green hydrogen solutions company. Agenda for the Call Q2/2023 Highlights & Financial ReviewMarket and Commercial Update2023 Targets and Revenue GuidanceManagement Q&amp;A Join the webcast: Date: August 30, 2023Time: 10:00am ETPart",0.0,Neutral,-0.03766233766233767,Negative,HTOO
Fusion Fuel Submits Three Green Hydrogen Projects to Spanish H2 Pioneers II Program,"SABUGO, Portugal, Aug. 17, 2023 (GLOBE NEWSWIRE) -- Fusion Fuel (NASDAQ: HTOO) announced today that it has submitted three projects to the H2 Pioneers II program, the second such funding call for innovative green hydrogen projects within the framework of the Spanish Recovery, Transformation and Resilience Plan (PERTE). H2 Pioneers II has been allocated €150 million to support the implementation of innovative projects that combine the production and local consumption of renewable hydrogen, in par",-0.1,Negative,0.1142857142857143,Positive,HTOO
15 Worst Performing Utility Stocks in 2023,"In this piece, we will take a look at the 15 worst performing utility stocks in 2023. If you want to skip out on our introduction about the utility sector and how it became quite important last year, then head on over to 5 Worst Performing Utility Stocks in 2023. The utility industry became one […]",-1.0,Negative,-0.4,Negative,HTOO
Fusion Fuel Signs Green Hydrogen Supply Agreement with Spanish Customer,"SABUGO, Portugal, Aug. 03, 2023 (GLOBE NEWSWIRE) -- Fusion Fuel (NASDAQ: HTOO) announced today that it has entered into a long-term green hydrogen offtake contract with a Spanish industrial group. The hydrogen is to be produced at a 2.5 MW green hydrogen project in Toledo, Spain that Fusion Fuel plans to develop in 2024. Earlier this year the project was awarded €3.3 million in grant funding from Spain’s H2 Pioneros program. The long-term supply agreement, which provides for the supply of 111.5",-0.1,Negative,-0.1,Negative,HTOO
"3 Hydrogen Stocks to Buy to Turn $5,000 Into $1 Million","While turning $5,000 into $1 million is an extremely tall order – a 200-bagger if we’re counting – should such a fantastical return materialize, the top hydrogen stocks to buy have a better shot of facilitating this profit magnitude than many other sectors. It just comes down to pure relevance. According to MarketsandMarkets, the hydrogen generation sector reached a valuation of $160 billion last year. By 2027, the segment could hit $263.5 billion, growing at a compound annual growth rate (CAGR)",0.0,Neutral,0.14541446208112874,Positive,HTOO
The 3 Best Hydrogen Stocks to Buy in January 2024,"Hydrogen stocks will continue to be in focus in 2024. Countries around the world and their citizens continue to express concern over issues including global warming and decarbonization among others. Hydrogen is particularly important in this regard. When burned, it produces no carbon dioxide. Further, the production of hydrogen produces relatively less greenhouse gas overall making it an attractive choice moving forward. Hydrogen stocks run the gamut from highly speculative to well-established f",1.0,Positive,0.17047619047619048,Positive,HTOOW
Fusion Fuel Green Hosts Third Quarter 2023 Investor Update,"SABUGO, Portugal, Dec. 04, 2023 (GLOBE NEWSWIRE) -- Fusion Fuel Green plc (NASDAQ: HTOO) (""Fusion Fuel""), an emerging leader in the green hydrogen sector, today announced financial results for the third quarter ended September 30, 2023. The quarterly shareholder letter is available at https://ir.fusion-fuel.eu/financials-filings/earnings-releases Third Quarter 2023 Highlights Announced long-term green hydrogen supply contract with a Spanish industrial group​Strategic partnership with Duferco Ene",-0.1,Negative,-0.025,Negative,HTOOW
Fusion Fuel Receives Purchase Order for 1.25 MW HEVO-Chain Electrolyzer,"Contract further reinforces market acceptance of plug-and-play HEVO-Chain system, strengthens Fusion Fuel’s footprint in hydrogen mobilitySABUGO, Portugal, Nov. 30, 2023 (GLOBE NEWSWIRE) -- Fusion Fuel (NASDAQ: HTOO) announced today that it has entered into a sales contract for a 1.25 MW HEVO-Chain Series NC electrolyzer. The system will employ Fusion Fuel’s plug-and-play HEVO™ technology, which uses modular building blocks to design green hydrogen solutions tailored to individual customer needs",0.0,Neutral,-0.06666666666666667,Negative,HTOOW
"Fusion Fuel Green Announces Strategic Tranched Financing from Belike Nominees Pty Ltd., a Macquarie Group Company","DUBLIN, Ireland, Nov. 27, 2023 (GLOBE NEWSWIRE) -- Fusion Fuel Green PLC (Nasdaq: HTOO) (“Fusion Fuel” or the “Company”), an emerging leader in the green hydrogen sector, today announced that it has entered into an agreement with Macquarie Group’s Commodities and Global Markets business (“Macquarie”) for financing of up to $20 million of senior convertible notes (the “Financing”) pursuant to a securities subscription agreement (“Subscription Agreement”), subject to the satisfactions of certain c",-0.2,Negative,-0.07047619047619047,Negative,HTOOW
Fusion Fuel Announces Third Quarter 2023 Webcast Date,"SABUGO, Portugal, Nov. 21, 2023 (GLOBE NEWSWIRE) -- Fusion Fuel Green plc (NASDAQ: HTOO) announced today that it will be hosting a live conference call and webcast on Monday, December 4, 2023, to discuss third quarter financial results and operational highlights for the green hydrogen solutions company. Agenda for the Call: 3Q23 Highlights & Financial ReviewMarket and Commercial Update2023/24 Targets and Revenue GuidanceManagement Q&amp;A Join the Webcast: Date: December 4, 2023Time: 10:00am ETParti",0.0,Neutral,-0.03766233766233767,Negative,HTOOW
Fusion Fuel Receives Purchase Order from Portuguese Energy Company for 1.25 MW Electrolyzer Facility,"Agreement marks another important milestone in continued commercialization of HEVO-Chain system, advancing hydrogen mobility in northern PortugalSABUGO, Portugal, Nov. 08, 2023 (GLOBE NEWSWIRE) -- Fusion Fuel (NASDAQ: HTOO) announced today that it has entered into a sales contract with a Portuguese energy company for a 1.25 MW HEVO-Chain Series NC electrolyzer. The system will employ Fusion Fuel’s plug-and-play HEVO™ technology, which uses modular building blocks to deliver green hydrogen soluti",0.0,Neutral,0.1,Positive,HTOOW
Fusion Fuel Green Receives Nasdaq Deficiency Notice Regarding Minimum Bid Price Requirement,"Ordinary shares will continue to trade on the Nasdaq Global Market, and the Company’s listing on such exchange is not affected by the receipt of the NoticeDUBLIN, Ireland, Nov. 07, 2023 (GLOBE NEWSWIRE) -- On November 7, 2023, Fusion Fuel Green Plc (NASDAQ: HTOO) (the “Company”), an emerging leader in the green hydrogen space, disclosed that on November 6, 2023 the Company received notice (the “Notice”) from the Nasdaq Stock Market LLC (“Nasdaq”) that the Company is not currently in compliance w",-0.2,Negative,-0.10833333333333334,Negative,HTOOW
15 Biggest Renewable Energy Companies in Europe,"In this article, we will take a look at the 15 biggest renewable energy companies in Europe. If you want to skip our detailed analysis, go directly to 5 Biggest Renewable Energy Companies in Europe. According to a report by the European Environment Agency, the region has been significantly advancing in using renewable energy sources. The […]",0.0,Neutral,0.21875,Positive,HTOOW
3 Hydrogen Stocks That Will Make Early Investors Rich,"With the global push to find clean and sustainable sources of energy, investors need to keep close tabs on hydrogen stocks to make you rich. Granted, this sector isn’t appealing to everyone because of its volatility and unpredictable nature. At the same time, those seeking gargantuan returns may want to earmark this industry for later analysis. Compellingly, Grand View Research points out that in 2022, the global hydrogen generation market reached a valuation of $155.35 billion. Further, experts",0.2375,Positive,0.13863636363636364,Positive,HTOOW
Fusion Fuel (HTOO) Receives Purchase Order for HEVO-Chain Tech,Fusion Fuel (HTOO) signs a contract to sell its first 300 kW Electrolyzer and Balance of Plant System.,0.0,Neutral,0.25,Positive,HTOOW
Fusion Fuel Receives Purchase Order for 300 kW Electrolyzer and Balance of Plant System from Leading Global Building Solutions Supplier,"Milestone contract represents first sale of HEVO-Chain technology to replace the use of fossil fuels in the industrial sectorSABUGO, Portugal, Sept. 27, 2023 (GLOBE NEWSWIRE) -- Fusion Fuel (NASDAQ: HTOO), a developer of disruptive green hydrogen solutions, is pleased to announce that it has achieved a significant milestone in the commercialization of its HEVO-Chain system with the signing of a contract with a global leader in innovative and sustainable building solutions, operating in the cemen",0.0,Neutral,0.23750000000000002,Positive,HTOOW
Elemental Clean Fuels partners with Piney Point Capital and Fusion Fuel to advance Decarbonization Projects in North America,"NEW YORK, Sept. 14, 2023 (GLOBE NEWSWIRE) -- Elemental Clean Fuels (“ECF”), an energy development company focused on the emerging clean fuel economy in North America, today announced that it has recently closed on its first round of external financing from investors Piney Point Capital, a Racon Capital investment vehicle, and Fusion Fuel Green plc (NASDAQ: HTOO) (""Fusion Fuel""), a green hydrogen solutions company. Capital investment provided by Piney Point will be utilized by ECF to further deve",0.3666666666666667,Positive,0.04196969696969698,Positive,HTOOW
"Fusion Fuel Announces Strategic Partnership with Elemental Clean Fuels, Strengthens Foothold in North American Green Hydrogen Market","DUBLIN, Ireland, Sept. 14, 2023 (GLOBE NEWSWIRE) -- Fusion Fuel Green plc (NASDAQ: HTOO) (“Fusion Fuel”), a green hydrogen solutions company, announced today that it has entered into definitive agreements with Elemental Clean Fuels (“Elemental”), a newly formed and funded development company focused on originating and developing clean fuel projects in North America. Elemental is led by Zach Steele and Jason Baran, formerly senior executives at Fusion Fuel, along with Jeff Crone, a former advisor",0.05555555555555556,Positive,0.0670995670995671,Positive,HTOOW
Q2 2023 Fusion Fuel Green PLC Earnings Call,Q2 2023 Fusion Fuel Green PLC Earnings Call,-0.2,Negative,-0.2,Negative,HTOOW
