titles,summaries,title_sentiment_polarity,title_sentiment,summary_sentiment_polarity,summary_sentiment,company
Why Is Jazz (JAZZ) Up 2.6% Since Last Earnings Report?,Jazz (JAZZ) reported earnings 30 days ago. What's next for the stock? We take a look at earnings estimates for some clues.,0.0,Neutral,0.0,Neutral,JAZZ
Jazz Pharmaceuticals' 2022 Corporate Sustainability and Social Impact Report: Serving our Global Communities,"NORTHAMPTON, MA / ACCESSWIRE / December 8, 2023 / Jazz PharmaceuticalsOriginally Published in Jazz Pharmaceuticals' 2022 Corporate Sustainability and Social Impact ReportManagement ApproachWe aim to be an engaged corporate citizen globally and in ...",0.011111111111111112,Positive,0.008333333333333333,Positive,JAZZ
Jazz Pharmaceuticals to Present Long-Term and Real-World Data Emphasizing Commitment to Treatment-Resistant Epilepsy at the 2023 American Epilepsy Society Annual Meeting,"Jazz Pharmaceuticals plc (Nasdaq: JAZZ) today announced that nine company-sponsored presentations, including five late-breaking abstracts, will be shared at the 2023 American Epilepsy Society (AES) annual meeting, being held December 1-5 in Orlando, Florida.",0.0,Neutral,0.0,Neutral,JAZZ
Jazz Pharmaceuticals to Present New Data Highlighting Advancements in Solid Tumors and Rare Blood Cancers at Upcoming Oncology Meetings,Jazz Pharmaceuticals plc (Nasdaq: JAZZ) today announced that the Company and its partners will present two abstracts at the 2023 San Antonio Breast Cancer Symposium (SABCS) from December 5-9; 11 abstracts at the 65th Annual American Society of Hematology (ASH) Annual Meeting from December 9-12; and two abstracts at the International Association for the Study of Lung Cancer (IASLC) 2023 North America Conference on Lung Cancer (NACLC) from December 1-3. New data include updated findings from a Pha,0.10909090909090909,Positive,0.03409090909090909,Positive,JAZZ
James Hardie Teams Up with the Pro Football Hall of Fame to Create Innovative New PGA TOUR Champions Event - Debuting in 2025,"Today in the hallowed halls of the Pro Football Hall of Fame, PGA TOUR Champions and James Hardie (NYSE: JHX), a leader in North American home building products, unveiled an innovative new tournament that will pair legends of golf and football.",0.3181818181818182,Positive,0.21212121212121213,Positive,JHX
James Hardie Industries To Announce Third Quarter Fiscal Year 2024 Financial Results on 13 February 2024,"CHICAGO & SYDNEY, January 12, 2024--James Hardie Industries plc (ASX: JHX; NYSE: JHX) will announce financial results, for its third quarter ended 31 December 2023, on the ASX before market on Tuesday, 13 February 2024.",0.0,Neutral,0.0,Neutral,JHX
PGT Innovations (PGTI) Gains as It Sells Stake to Masonite,PGT Innovations' (PGTI) combination with Masonite is set to provide significant near-term value to its shareholders while enabling them to participate in the long-term upside opportunity of the combined company.,0.0,Neutral,0.375,Positive,JHX
Are Construction Stocks Lagging  James Hardie Industries (JHX) This Year?,Here is how James Hardie (JHX) and Lennar (LEN) have performed compared to their sector so far this year.,0.0,Neutral,0.1,Positive,JHX
Caesarstone (CSTE) to Close Richmond Hill Manufacturing Facility,Caesarstone (CSTE) plans to shut down its Richmond Hill manufacturing facility for $20 million in annual savings.,0.0,Neutral,-0.15555555555555559,Negative,JHX
Is Now An Opportune Moment To Examine James Hardie Industries plc (ASX:JHX)?,Today we're going to take a look at the well-established James Hardie Industries plc ( ASX:JHX ). The company's stock...,0.0,Neutral,0.0,Neutral,JHX
Is James Hardie Industries (JHX) Stock Outpacing Its Construction Peers This Year?,Here is how James Hardie (JHX) and Lennar (LEN) have performed compared to their sector so far this year.,0.0,Neutral,0.1,Positive,JHX
Is James Hardie Industries (JHX) Outperforming Other Construction Stocks This Year?,Here is how James Hardie (JHX) and Lennar (LEN) have performed compared to their sector so far this year.,-0.125,Negative,0.1,Positive,JHX
Shareholders Would Enjoy A Repeat Of James Hardie Industries' (ASX:JHX) Recent Growth In Returns,"There are a few key trends to look for if we want to identify the next multi-bagger. Firstly, we'd want to identify a...",0.2,Positive,0.012499999999999997,Positive,JHX
James Hardie Industries plc (NYSE:JHX) Q2 2024 Earnings Call Transcript,"James Hardie Industries plc (NYSE:JHX) Q2 2024 Earnings Call Transcript November 8, 2023 Operator: Thank you for standing by, and welcome to the James Hardie Second Quarter Fiscal Year 2024 Results Briefing. Today’s briefing is hosted by James Hardie CEO, Mr. Aaron Erter and CFO, Mrs. Rachel Wilson. After the briefing, we will open the […]",0.0,Neutral,0.26666666666666666,Positive,JHX
James Hardie Industries Announces Second Quarter Fiscal Year 2024 Results,"CHICAGO & SYDNEY, November 07, 2023--James Hardie Industries plc (ASX: JHX; NYSE: JHX), today announced results for its second quarter ending 30 September 2023.",0.0,Neutral,0.0,Neutral,JHX
Here’s Why James Hardie Industries plc (JHX) Outperformed in Q3,"L1 Capital, an investment management firm, released its “L1 Long Short Fund” third quarter 2023 investor letter, a copy of the same can be downloaded here. Equity markets across the globe had a promising start in July as constructive economic data strengthened investor hopes for a smooth landing in the US. However, the markets took a […]",0.0,Neutral,0.06875,Positive,JHX
James Hardie Industries plc's (ASX:JHX) Stock Has Been Sliding But Fundamentals Look Strong: Is The Market Wrong?,"James Hardie Industries (ASX:JHX) has had a rough three months with its share price down 11%. However, a closer look at...",-0.033333333333333354,Negative,-0.1277777777777778,Negative,JHX
James Hardie Industries To Announce Second Quarter Fiscal Year 2024 Financial Results on 8 November 2023,"SYDNEY & CHICAGO, October 06, 2023--James Hardie Industries plc (ASX: JHX; NYSE: JHX) will announce financial results, for its second quarter ended 30 September 2023, on the ASX before market on Wednesday, 8 November 2023.",0.0,Neutral,0.0,Neutral,JHX
Investors in James Hardie Industries (ASX:JHX) have seen solid returns of 121% over the past five years,James Hardie Industries plc ( ASX:JHX ) shareholders might be concerned after seeing the share price drop 15% in the...,-0.125,Negative,0.0,Neutral,JHX
10 Best ASX Stocks To Invest In,"In this article, we take a look at the 10 best ASX stocks to invest in. If you want to see more stocks listed on the ASX, go directly to the 5 Best ASX Stocks To Invest In. Australia, formally known as the Commonwealth of Australia, is an independent nation encompassing the primary landmass of […]",1.0,Positive,0.5,Positive,JHX
Are Investors Undervaluing James Hardie Industries plc (ASX:JHX) By 29%?,"Key Insights Using the 2 Stage Free Cash Flow to Equity, James Hardie Industries fair value estimate is AU$59.36 James...",0.0,Neutral,0.3666666666666667,Positive,JHX
Are Construction Stocks Lagging  EMCOR Group (EME) This Year?,Here is how Emcor Group (EME) and James Hardie (JHX) have performed compared to their sector so far this year.,0.0,Neutral,0.1,Positive,JHX
Institutional investors are James Hardie Industries plc's (ASX:JHX) biggest bettors and were rewarded after last week's AU$715m market cap gain,Key Insights Institutions' substantial holdings in James Hardie Industries implies that they have significant influence...,0.0,Neutral,0.1875,Positive,JHX
Here’s Why James Hardie Industries plc (JHX) Rose in Q2,"L1 Capital, an investment management firm, released its “L1 Long Short Fund” second quarter 2023 investor letter, a copy of the same can be downloaded here. Global markets were mixed over the quarter, while the US stock market performed strongly due to the strength in technology mega-cap stocks. The portfolio returned 0.1% in the second quarter […]",0.6,Positive,-0.041666666666666664,Negative,JHX
Mural Oncology Reports Inducement Grants Under Nasdaq Listing Rule 5635(c)(4),"DUBLIN, Ireland, Feb. 05, 2024 (GLOBE NEWSWIRE) -- Mural Oncology plc (Nasdaq: MURA), a clinical-stage immuno-oncology company leveraging its core competencies in immune cell modulation and protein engineering to develop novel, investigational engineered cytokine therapies designed to address areas of unmet need for patients with a variety of cancers, today announced that on February 2, the Company granted to two newly hired employees (i) non-statutory stock options to purchase an aggregate of 9",0.0,Neutral,0.13636363636363635,Positive,MURA
Mural Oncology Announces Enhancements to Late-Stage Clinical Trials,"Strategic changes to ARTISTRY-6 and ARTISTRY-7, both potentially registrational trials of nemvaleukin, are intended to result in more clinically meaningful data Mural intends to nominate development candidates for its engineered therapies targeting interleukin-18 and interleukin-12 programs in 2024 The Company reiterates current cash runway projection into 4Q 2025 DUBLIN, Ireland, Jan. 08, 2024 (GLOBE NEWSWIRE) -- Mural Oncology plc (Nasdaq: MURA), a clinical-stage immuno-oncology company develo",0.0,Neutral,0.25,Positive,MURA
The CEO of Europe’s largest airline is about to trigger a $108 million bonus that British shareholders can’t vote on because of Brexit,Ryanair’s stock is just a dollar away from triggering the massive bonus for CEO Michael O’Leary.,0.0,Neutral,0.0,Neutral,RYAAY
Port of Dover threatens legal action over Brexit lorry checks,Health authorities at the Port of Dover could bring legal action against the Government if it does not reconsider a plan to move checks on potentially dangerous foods away from the port creating what they say is a biosecurity risk.,0.15000000000000002,Positive,-0.09999999999999998,Negative,RYAAY
Ryanair hits out at On the Beach in new attack on ‘pirate’ travel websites,Ryanair has accused On The Beach of overcharging customers in a fresh attack on “pirate” travel websites.,0.13636363636363635,Positive,0.3,Positive,RYAAY
Ryanair’s €100-Million CEO Bonus Troubles Barclays Analysts,"(Bloomberg) -- A potential €100 million ($108 million) payout to Ryanair Holdings Plc Chief Executive Officer Michael O’Leary raises corporate governance concerns, according to analysts at Barclays Plc.Most Read from BloombergBiden’s Attempt to Address Memory Issue Backfires With New GaffeChina’s Property Crisis Is Starting to Ripple Across the WorldStock Mania Rages On as S&amp;P 500 Closes Above 5,000: Markets WrapNew York City Is Considering a Laundry Pods CrackdownPutin Showed Carlson Why He Rea",0.0,Neutral,0.02727272727272727,Positive,RYAAY
Budget airline Ryanair offered to snap up extra Boeing aircraft after Alaska Airlines blowout—but now it says it is concerned about the quality after all,"""I think we're concerned because it highlights, you know, poor production quality with Boeing,"" O'Leary said of U.S. regulators' findings.",0.0,Neutral,-0.4,Negative,RYAAY
"Ryanair CEO: Boeing quality is a concern, further delays possible","Ryanair is concerned by shortcomings identified by U.S. regulators in a report into the Alaska Airlines 737 MAX 9 accident, and increased regulatory supervision is set to ""slow things down"" at Boeing, CEO Michael O'Leary said on Wednesday.  Ryanair, Europe's largest airline by passenger numbers and one of Boeing's main customers, has ordered over 350 MAX jets in recent years, but has no MAX 9 aircraft.  A door plug that flew off an Alaska Airlines MAX 9 jet mid-flight on Jan. 5 appeared to be missing four key bolts, according to a preliminary report by the U.S. National Transportation Safety Board released on Tuesday.",0.0,Neutral,-0.0814814814814815,Negative,RYAAY
Europe’s biggest airline is taking no prisoners in its battle with online ticket ‘pirates’,Michael O’Leary is known to take no prisoners.,0.0,Neutral,0.0,Neutral,RYAAY
Ryanair is taking no prisoners in its battle with online ticket ‘pirates’,Michael O’Leary is known to take no prisoners.,0.0,Neutral,0.0,Neutral,RYAAY
Ryanair again wins court challenge against KLM's Dutch bailout,"BRUSSELS/AMSTERDAM (Reuters) -Ryanair on Wednesday won its second challenge against a 3.4-billion-euro ($3.7 billion) Dutch bailout for Air France-KLM's Dutch unit after an EU court ruled competition regulators had not taken into account all beneficiaries within the airline group.  Ryanair in 2021 won the same court's backing against the Dutch state aid, one of a score of challenges it launched after EU governments pumped billions of euros into the pandemic-hit airline industry.  The European Commission subsequently re-examined the case and again cleared it, saying that the state aid was necessary and proportionate.",0.3,Positive,0.0,Neutral,RYAAY
DLAKY vs. RYAAY: Which Stock Is the Better Value Option?,DLAKY vs. RYAAY: Which Stock Is the Better Value Option?,0.5,Positive,0.5,Positive,RYAAY
Threat to summer holidays as new production glitch worsens Boeing delivery delays,"Boeing is to delay work on dozens of its 737 Max jets after fresh problems were flagged by a supplier, in a potential threat to families’ summer holiday plans.",0.13636363636363635,Positive,0.15,Positive,RYAAY
Europe’s largest airline is getting into the landlord business because its new hires can’t find housing amid Dublin’s rent crisis,"“This accommodation, which is located one bus stop from Dublin Airport, will be rented at affordable rates to Ryanair cabin crew,” a spokesperson told Fortune.",0.13636363636363635,Positive,0.0,Neutral,RYAAY
Low-cost airlines report busier January but fill fewer seats on planes,Ryanair said it had to cancel more than 950 flights due to the Israel-Hamas conflict.,0.0,Neutral,0.1875,Positive,RYAAY
Ryanair forced to fly with empty seats after travel website ban,Ryanair was forced to fly planes with more than one in ten seats empty last month after Michael O’Leary’s budget airline was banned by a host of online travel agent websites.,0.13333333333333333,Positive,0.15,Positive,RYAAY
"Ryanair (RYAAY) Q3 Earnings & Revenues Lag, FY24 View Tepid",Ryanair's (RYAAY) fuel bill in Q3 jumps 35% year over year.,0.0,Neutral,0.0,Neutral,RYAAY
"Ryanair will take as many Boeing MAX 10s as it can get, says CEO","Ryanair will take as many Boeing MAX 10 aircraft as it can get, the airline's CEO told Reuters on Tuesday, reiterating his confidence in the U.S. planemaker.  Boeing, long a symbol of America's manufacturing prowess, is in the crosshairs of regulators, politicians and airlines following a harrowing mid-air cabin panel blowout on a passenger-filled 737 MAX 9 jet operated by Alaska Airlines earlier this month.  On Monday, Boeing said it was withdrawing a request for a key safety exemption that could have allowed U.S. regulators to speed up certification of its coming 737 MAX 7, in the latest fallout from the planemaker's ongoing crisis.",0.5,Positive,0.15833333333333333,Positive,RYAAY
Europe’s biggest airline has ‘a lot of confidence’ in Boeing chief David Calhoun,"The CEO of Europe’s largest airline, who not so long ago described Boeing management as “headless chickens,” has come out in strong support of the beleaguered US planemaker, pushing back against criticism from several other carriers after this month’s mid-flight breakage on a Boeing aircraft.",0.0,Neutral,0.05166666666666666,Positive,RYAAY
Ryanair Holdings plc (NASDAQ:RYAAY) Q3 2024 Earnings Call Transcript,"Ryanair Holdings plc (NASDAQ:RYAAY) Q3 2024 Earnings Call Transcript January 29, 2024 Ryanair Holdings plc misses on earnings expectations. Reported EPS is $0.07 EPS, expectations were $0.35. RYAAY isn’t one of the 30 most popular stocks among hedge funds at the end of the third quarter (see the details here). Michael O’Leary: Okay. Good morning, […]",0.0,Neutral,0.45999999999999996,Positive,RYAAY
Ryanair looks for Polish government support for ambitious growth,"Ryanair is hoping that Poland's new pro-European government will support its growth plans in the country which assume a doubling in size over the next 6-8 years, CEO Michael O'Leary said on Tuesday.  A new government headed by former European Council President Donald Tusk took power in Poland in December after 8 years of nationalist Law and Justice (PiS) party rule.",0.25,Positive,0.05454545454545454,Positive,RYAAY
Ryanair CEO says he has confidence in Boeing,"Ryanair CEO Michael o’Leary said on Tuesday he had a lot of confidence in U.S. planemaker Boeing but added that it needed to improve the quality of its aircraft.  ""We have a lot of confidence in Boeing, I think the CEO and CFO ... are getting a lot of unfair criticism for a lot of poor management on the floor in Seattle,"" he told a news conference in Warsaw.",0.0,Neutral,-0.45,Negative,RYAAY
SMX SPEARHEADS SUSTAINABLE FASHION AT PREMIÈRE VISION PARIS,"SMX (Security Matters) PLC (NASDAQ:SMX; SMXWW) is pleased to announce its attendance at the February 6-8, 2024 Première Vision event in Paris, France. Première Vision is a bi-annual event for fashion professionals. The SMX sales and marketing team have meetings scheduled with key suppliers as well as major lifestyle and luxury brands.",0.0,Neutral,0.1875,Positive,SMX
SMX SECURES US$5 MILLION CONTRACT WITH R&I FOR NATO SUPPLY CHAIN TRANSPARENCY,"SMX (Security Matters) PLC (NASDAQ:SMX; SMXWW) is pleased to announce a $5 million contract with R&amp;I Trading of New York. This project, spearheaded by the SMX team, will deploy SMX's cutting-edge technology to enhance supply chain transparency with respect to a NATO member state and with the expectation of expanding to further NATO member states",0.0,Neutral,0.21212121212121213,Positive,SMX
SMX Announces Planned Launch of World's First Plastic Cycle Token,"SMX (Security Matters) PLC (NASDAQ:SMX; SMXWW), a pioneer in digitizing physical objects for a circular economy, has announced today the planned launch of a groundbreaking plastic cycle token, scheduled for release in Q2 2024. Amidst a global context where only an estimated 9% of plastic is recycled1 (OECD, 2022) in a market valued at over $40 billion2 (Statista, 2021), this initiative is being designed to present a reliable, ethical digital credit platform, aiming to capitalize on billions of d",0.25,Positive,0.03333333333333333,Positive,SMX
SMX Secures Majority Stake in True Gold Consortium,"SMX (Security Matters) PLC (NASDAQ:SMX; SMXWW) has signed an agreement dated Oct. 3, 2023 with True Gold Consortium Pty Ltd (""TrueGold""), to acquire an additional 7.5% equity stake, thereby increasing the Company's common share holdings in privately held TrueGold to 51.9%. This key acquisition in a sector expected to benefit from their traceability, verification, and certification technology, helps solidify the partnership between SMX and the other shareholders of TrueGold.",0.35,Positive,-0.02916666666666667,Negative,SMX
Domaine Des Massifs and SMX Have Launched a Joint Project To Certify The Origin Of The Raw Material That Is Traceable In The Finished Product,"SMX (Security Matters) PLC (NASDAQ:SMX; SMXWW), an innovative company specializing in digitization of physical objects to foster a circular and closed loop economy, have launched a collaborative project with Domaine des Massifs, an industry leader in leather sourcing. Together, they aim to offer and establish a comprehensive system for their clients, achieving full traceability, verification, and certification of the origin of raw materials from farm to finished products.",-0.23076923076923078,Negative,0.10384615384615384,Positive,SMX
Domaine des Massifs and SMX have Formed a Strategic Collaboration to Revolutionize Traceability.,"SMX (Security Matters) PLC (NASDAQ: SMX; SMXWW), an innovative company specializing in digitization of physical objects to foster a circular and closed loop economy, has announced a collaborative strategic partnership with Domaine des Massifs, an industry leader in leather sourcing. Together, they aim to offer and establish a comprehensive system for their clients, achieving full traceability, verification, and certification of the origin of raw materials from farm to finished products.",0.0,Neutral,0.10384615384615384,Positive,SMX
SMX Leads the Transition from Linear to Circular Production through the Success in Marking rPET for Textile Production Applications,"SMX (Security Matters) plc (Nasdaq: SMX) (""SMX"" or ""the Company""), a company focused on digitizing physical objects on the blockchain to enable a circular and closed loop economy, would like to notify the market that, alongside Indorama Ventures, a leading global chemicals company, they have successfully marked rPET granule raw material for textile production.",0.3,Positive,-0.046153846153846156,Negative,SMX
SMX Announces Effective Date of Reverse Stock Split,"SMX (Security Matters) Public Limited Company (NASDAQ: SMX; SMXWW) (the ""Company""), today announced that the reverse stock split of the Company's ordinary shares, which was previously approved by the Company's shareholders on August 8, 2023, will begin trading on an adjusted basis giving effect to the reverse stock split on August 21, 2023 under the existing ticker symbol ""SMX"". The new CUSIP number of the Company's ordinary shares will be G8267K141 and the new ISIN code will be IE0000TSCWD4.",0.6,Positive,-0.06648113790970933,Negative,SMX
SMX International Legal Prosecuting Task Force to Take Further Action on Illegal Shorts and Spoofing,"SMX (Security Matters) Public Limited Company (NASDAQ: SMX) (NASDAQ:SMXWW), today announces an update in its progress in dealing with alleged naked short selling activity. SMX engaged the services of the law firm Seiden Law LLP and retired senior FBI official Joshua Skule last Spring after suspicious trading in SMX shares was noted. Since this time, the task force has been coordinating and sharing information with NASDAQ and FINRA. SMX continues to work with them and is dedicated to ensuring the",-0.039999999999999994,Negative,-0.05306122448979592,Negative,SMX
SMX Announces Receipt of Nasdaq Listing Delinquency Notice,"SMX (Security Matters) plc (NASDAQ:SMX; SMXWW) announces that on August 4, 2023, it received a delinquency notification letter from the Listing Qualifications Staff of the Nasdaq Stock Market LLC due to the Company's non-compliance with Nasdaq Listing Rule 5450(b)(2)(C) (the ""MVPHS Rule""), as the Company has not maintained a minimum Market Value of Publicly Held Shares of $15,000,000 for 30 consecutive business days, from June 22, 2023 to August",0.0,Neutral,-0.0625,Negative,SMX
SMX (Security Matters) Enters into Sales Cooperation Agreement with Data Vault,"SMX (Security Matters) PLC (NASDAQ:SMX; SMXWW) today announced that it has entered into a Sales Cooperation Agreement with Data Vault Holdings, Inc., which acts in the area of Web 3.0 technologies, crypto anchors and data software as a service, pursuant to which each party on a non-exclusive basis will effect introductions of potential clients to the other.",0.0,Neutral,-0.0625,Negative,SMX
SMX (Security Matters) PLC (NASDAQ: SMX) Revolutionizing Transparency and Sustainability,"NEW YORK, NY - (NewMediaWire) - June 29, 2023 - The world landscape is undergoing a profound transformation in an age of quick technological development and a growing awareness of the need for sustainability practices. As the barriers between the phy...",0.0,Neutral,0.18434343434343434,Positive,SMX
SMX Reports Strong Client Adoption and Growth in 2023,"NEW YORK, NY - (NewMediaWire) - Security Matters plc (NASDAQ: SMX) (""SMX"" or ""the Company""), a company focused on digitizing physical objects on the blockchain to enable a circular and closed loop economy, is proud to share an update on strong growth...",0.4333333333333333,Positive,0.25393939393939396,Positive,SMX
SMX (Security Matters) Public Limited Company Announces Closing of $3.2 Million Public Offering for Growth Capital,"SMX (Security Matters) PLC (NASDAQ:SMX; SMXWW) announced today the closing of its previously announced underwritten public offering of securities for gross proceeds of approximately $3.24 million, prior to deducting underwriting discounts and commissions and offering expenses payable by the Company and excluding any exercise of the underwriter's option to purchase any additional securities as described herein.",-0.023809523809523808,Negative,-0.11333333333333333,Negative,SMX
SMX (Security Matters) Public Limited Company Announces Pricing of $3.2 Million Public Offering,"SMX (Security Matters) PLC (NASDAQ:SMX; SMXWW) announced today an underwritten public offering of securities for gross proceeds of approximately $3.2 million, prior to deducting underwriting discounts and commissions and offering expenses payable by the Company and excluding any exercise of the underwriter's option to purchase any additional securities as described herein.",-0.023809523809523808,Negative,-0.1,Negative,SMX
SMX Achieves 100% Year-To-Date Growth in Commercialization Driven by Client Adoption & Transformation Across Industries,"Security Matters plc (Nasdaq: SMX) (""SMX"" or ""the Company""), a global leader in transforming supply chain marking, tracking, and measuring technologies, reports rapid growth in client adoption, across multiple industries, of its proprietary technologies that allow clients and end-users to see the entire history and composition of materials, from virgin to recycled state, including how many times it's been recycled. This allows clients to better manage manufacturing challenges, address ESG concer",0.0,Neutral,0.2,Positive,SMX
